{
  "contract_version": "spine.trusted-web-command-registry.v1",
  "status": "draft_contract_only",
  "baseline_spine_version": "0.3.0",
  "baseline_ledger_schema": "12",
  "commands": [
    {
      "command": "item.occurrences",
      "access_mode": "read",
      "request_schema": "trusted-web-command-payloads.schema.json#/$defs/itemOccurrencesRequest",
      "response_schema": "recurrence-occurrence-response.schema.json",
      "request_contract_version": null,
      "response_contract_version": "spine.item-occurrences.recurrence.v1",
      "request_version_field": null,
      "response_version_field": "response_contract",
      "required_contract_versions": [
        "spine.canonical-json.v1",
        "spine.item-occurrences.recurrence.v1",
        "spine.recurrence.contract.v1"
      ],
      "resolver": "item_read_all_returned_references",
      "projection": "canonical_complete_or_deny",
      "requires_create_owner_scope": false,
      "requires_expected_access_epoch": false
    },
    {
      "command": "item_archetype.list",
      "access_mode": "read",
      "request_schema": "notification-profile-commands.schema.json#/$defs/archetypeList",
      "response_schema": "command-response.schema.json",
      "request_contract_version": "spine.item-archetypes.v1",
      "response_contract_version": "spine.item-archetypes.v1",
      "request_version_field": "contract_version",
      "response_version_field": "response_contract",
      "required_contract_versions": [
        "spine.canonical-json.v1",
        "spine.item-archetypes.v1",
        "spine.notification-profile-catalog-cursor.v1",
        "spine.notification-profile-readback.v1"
      ],
      "resolver": "catalog_scope_and_returned_references",
      "projection": "canonical_complete_or_deny",
      "requires_create_owner_scope": false,
      "requires_expected_access_epoch": false
    },
    {
      "command": "item_archetype.show",
      "access_mode": "read",
      "request_schema": "notification-profile-commands.schema.json#/$defs/archetypeShow",
      "response_schema": "command-response.schema.json",
      "request_contract_version": "spine.item-archetypes.v1",
      "response_contract_version": "spine.item-archetypes.v1",
      "request_version_field": "contract_version",
      "response_version_field": "response_contract",
      "required_contract_versions": [
        "spine.canonical-json.v1",
        "spine.item-archetypes.v1",
        "spine.notification-profile-catalog-cursor.v1",
        "spine.notification-profile-readback.v1"
      ],
      "resolver": "catalog_scope_and_returned_references",
      "projection": "canonical_complete_or_deny",
      "requires_create_owner_scope": false,
      "requires_expected_access_epoch": false
    },
    {
      "command": "notification_profile.binding.list",
      "access_mode": "read",
      "request_schema": "notification-profile-commands.schema.json#/$defs/bindingList",
      "response_schema": "command-response.schema.json",
      "request_contract_version": "spine.notification-profile-bindings.v1",
      "response_contract_version": "spine.notification-profile-bindings.v1",
      "request_version_field": "contract_version",
      "response_version_field": "response_contract",
      "required_contract_versions": [
        "spine.canonical-json.v1",
        "spine.item-archetypes.v1",
        "spine.notification-profile-bindings.v1",
        "spine.notification-profile-catalog-cursor.v1",
        "spine.notification-profile-readback.v1",
        "spine.notification-profiles.v1"
      ],
      "resolver": "catalog_scope_and_returned_references",
      "projection": "canonical_complete_or_deny",
      "requires_create_owner_scope": false,
      "requires_expected_access_epoch": false
    },
    {
      "command": "notification_profile.list",
      "access_mode": "read",
      "request_schema": "notification-profile-commands.schema.json#/$defs/profileList",
      "response_schema": "command-response.schema.json",
      "request_contract_version": "spine.notification-profiles.v1",
      "response_contract_version": "spine.notification-profiles.v1",
      "request_version_field": "contract_version",
      "response_version_field": "response_contract",
      "required_contract_versions": [
        "spine.canonical-json.v1",
        "spine.notification-profile-catalog-cursor.v1",
        "spine.notification-profile-readback.v1",
        "spine.notification-profiles.v1"
      ],
      "resolver": "catalog_scope_and_returned_references",
      "projection": "canonical_complete_or_deny",
      "requires_create_owner_scope": false,
      "requires_expected_access_epoch": false
    },
    {
      "command": "notification_profile.resolve",
      "access_mode": "read",
      "request_schema": "notification-profile-commands.schema.json#/$defs/resolve",
      "response_schema": "command-response.schema.json",
      "request_contract_version": "spine.notification-profile-bindings.v1",
      "response_contract_version": "spine.notification-profile-bindings.v1",
      "request_version_field": "contract_version",
      "response_version_field": "response_contract",
      "required_contract_versions": [
        "spine.canonical-json.v1",
        "spine.item-archetypes.v1",
        "spine.notification-profile-bindings.v1",
        "spine.notification-profile-catalog-cursor.v1",
        "spine.notification-profile-readback.v1",
        "spine.notification-profiles.v1"
      ],
      "resolver": "catalog_scope_chain_read_use",
      "projection": "canonical_complete_or_deny",
      "requires_create_owner_scope": false,
      "requires_expected_access_epoch": false
    },
    {
      "command": "notification_profile.show",
      "access_mode": "read",
      "request_schema": "notification-profile-commands.schema.json#/$defs/profileShow",
      "response_schema": "command-response.schema.json",
      "request_contract_version": "spine.notification-profiles.v1",
      "response_contract_version": "spine.notification-profiles.v1",
      "request_version_field": "contract_version",
      "response_version_field": "response_contract",
      "required_contract_versions": [
        "spine.canonical-json.v1",
        "spine.notification-profile-catalog-cursor.v1",
        "spine.notification-profile-readback.v1",
        "spine.notification-profiles.v1"
      ],
      "resolver": "catalog_scope_and_returned_references",
      "projection": "canonical_complete_or_deny",
      "requires_create_owner_scope": false,
      "requires_expected_access_epoch": false
    },
    {
      "command": "schedule.build",
      "access_mode": "read",
      "request_schema": "schedule-countdown-builder-request.schema.json",
      "response_schema": "schedule-countdown-builder-response.schema.json",
      "request_contract_version": "spine.schedule-countdown-builder.v1",
      "response_contract_version": "spine.schedule-countdown-builder-response.v1",
      "request_version_field": "contract_version",
      "response_version_field": "response_contract",
      "required_contract_versions": [
        "spine.canonical-json.v1",
        "spine.notification-schedule.contract.v1",
        "spine.schedule-countdown-builder-response.v1",
        "spine.schedule-countdown-builder.v1",
        "spine.schedule-create-normalization.v1",
        "spine.schedule-create.v2"
      ],
      "resolver": "create_scope_and_references",
      "projection": "canonical_complete_or_deny",
      "requires_create_owner_scope": true,
      "requires_expected_access_epoch": false
    },
    {
      "command": "schedule.cancel",
      "access_mode": "write",
      "request_schema": "schedule-cancel-request.schema.json",
      "response_schema": "schedule-cancel-response.schema.json",
      "request_contract_version": "spine.schedule-cancel.v1",
      "response_contract_version": "spine.schedule-cancel-response.v1",
      "request_version_field": "contract_version",
      "response_version_field": "response_contract",
      "required_contract_versions": [
        "spine.canonical-json.v1",
        "spine.notification-schedule.contract.v1",
        "spine.relative-temporal-binding.v1",
        "spine.schedule-cancel-receipt.v1",
        "spine.schedule-cancel-response.v1",
        "spine.schedule-cancel.v1",
        "spine.schedule-operations-normalization.v1"
      ],
      "resolver": "item_edit_stop_intent",
      "projection": "canonical_complete_or_deny",
      "requires_create_owner_scope": false,
      "requires_expected_access_epoch": true
    },
    {
      "command": "schedule.create",
      "access_mode": "write",
      "request_schema": "schedule-create-request.schema.json",
      "response_schema": "schedule-create-response.schema.json",
      "request_contract_version": "spine.schedule-create.v2",
      "response_contract_version": "spine.schedule-create-response.v2",
      "request_version_field": "contract_version",
      "response_version_field": "response_contract",
      "required_contract_versions": [
        "spine.canonical-json.v1",
        "spine.item-archetypes.v1",
        "spine.notification-opportunities.v1",
        "spine.notification-profile-application.v1",
        "spine.notification-profile-bindings.v1",
        "spine.notification-profiles.v1",
        "spine.notification-schedule-authoring.v1",
        "spine.notification-schedule.contract.v1",
        "spine.notification-schedule.normalization.v1",
        "spine.recurrence-authoring.v1",
        "spine.recurrence.contract.v1",
        "spine.recurrence.normalization.v1",
        "spine.schedule-create-normalization.v1",
        "spine.schedule-create-receipt.v2",
        "spine.schedule-create-response.v2",
        "spine.schedule-create.v2",
        "spine.schedule-primary-location-authoring.v1",
        "spine.schedule-primary-location-normalization.v1",
        "spine.schedule-primary-location-view.v1",
        "spine.schedule-primary-location.v1"
      ],